{
  "ticker": "CMIG4",
  "market": "B3",
  "analysis_focus": "dividends",
  "investment_horizon_years": 5,
  "required_return": 0.12,
  "desired_dividend_yields": [0.06, 0.08, 0.1, 0.12],
  "margin_of_safety": 0.25,
  "use_official_sources_only": false,
  "generate_full_report": true,
  "company": {
    "name": "Cemig",
    "sector": "Energia eletrica",
    "share_class": "PN",
    "currency": "BRL"
  },
  "market_data": {
    "current_price": 12.46,
    "price_history": [10.8, 11.1, 11.7, 12.0, 12.46],
    "dividend_history": [1.04, 1.18, 1.26, 1.34, 1.42]
  },
  "financials": [
    {
      "year": 2020,
      "revenue": 27900000000,
      "ebitda": 7600000000,
      "ebit": 5800000000,
      "net_income": 4300000000,
      "equity": 18000000000,
      "operating_cash_flow": 6100000000,
      "capex": 1900000000,
      "free_cash_flow": 4200000000,
      "dividends_paid": 2800000000,
      "shares_outstanding": 1430000000,
      "gross_debt": 14600000000,
      "cash": 4200000000,
      "depreciation_amortization": 1800000000,
      "working_capital_change": 200000000,
      "net_debt_issuance": -300000000,
      "tax_rate": 0.34
    },
    {
      "year": 2021,
      "revenue": 30500000000,
      "ebitda": 8100000000,
      "ebit": 6200000000,
      "net_income": 4550000000,
      "equity": 19200000000,
      "operating_cash_flow": 6400000000,
      "capex": 2100000000,
      "free_cash_flow": 4300000000,
      "dividends_paid": 3100000000,
      "shares_outstanding": 1430000000,
      "gross_debt": 15000000000,
      "cash": 4500000000,
      "depreciation_amortization": 1900000000,
      "working_capital_change": 250000000,
      "net_debt_issuance": -200000000,
      "tax_rate": 0.34
    },
    {
      "year": 2022,
      "revenue": 33200000000,
      "ebitda": 8800000000,
      "ebit": 6800000000,
      "net_income": 4900000000,
      "equity": 20500000000,
      "operating_cash_flow": 7000000000,
      "capex": 2200000000,
      "free_cash_flow": 4800000000,
      "dividends_paid": 3400000000,
      "shares_outstanding": 1430000000,
      "gross_debt": 14900000000,
      "cash": 4700000000,
      "depreciation_amortization": 2000000000,
      "working_capital_change": 280000000,
      "net_debt_issuance": -150000000,
      "tax_rate": 0.34
    },
    {
      "year": 2023,
      "revenue": 35500000000,
      "ebitda": 9300000000,
      "ebit": 7200000000,
      "net_income": 5200000000,
      "equity": 21900000000,
      "operating_cash_flow": 7400000000,
      "capex": 2350000000,
      "free_cash_flow": 5050000000,
      "dividends_paid": 3600000000,
      "shares_outstanding": 1430000000,
      "gross_debt": 15100000000,
      "cash": 5100000000,
      "depreciation_amortization": 2100000000,
      "working_capital_change": 320000000,
      "net_debt_issuance": -120000000,
      "tax_rate": 0.34
    },
    {
      "year": 2024,
      "revenue": 37800000000,
      "ebitda": 9800000000,
      "ebit": 7600000000,
      "net_income": 5500000000,
      "equity": 23300000000,
      "operating_cash_flow": 7900000000,
      "capex": 2450000000,
      "free_cash_flow": 5450000000,
      "dividends_paid": 3900000000,
      "shares_outstanding": 1430000000,
      "gross_debt": 14800000000,
      "cash": 5600000000,
      "depreciation_amortization": 2200000000,
      "working_capital_change": 350000000,
      "net_debt_issuance": -100000000,
      "tax_rate": 0.34
    }
  ]
}
